Reviewer_Decision,Key,Item Type,Publication Year,Author,Title,Publication Title,ISBN,ISSN,DOI,Url,Abstract Note,Date,Date Added,Date Modified,Access Date,Pages,Num Pages,Issue,Volume,Number Of Volumes,Journal Abbreviation,Short Title,Series,Series Number,Series Text,Series Title,Publisher,Place,Language,Rights,Type,Archive,Archive Location,Library Catalog,Call Number,Extra,Notes,File Attachments,Link Attachments,Manual Tags,Automatic Tags,Editor,Series Editor,Translator,Contributor,Attorney Agent,Book Author,Cast Member,Commenter,Composer,Cosponsor,Counsel,Interviewer,Producer,Recipient,Reviewed Author,Scriptwriter,Words By,Guest,Number,Edition,Running Time,Scale,Medium,Artwork Size,Filing Date,Application Number,Assignee,Issuing Authority,Country,Meeting Name,Conference Name,Court,References,Reporter,Legal Status,Priority Numbers,Programming Language,Version,System,Code,Code Number,Section,Session,Committee,History,Legislative Body
Exclude,8ZSX2H3F,journalArticle,2025,"Oh, Seeung; Bae, Yebin; Abraham Thompson, Isaiah; Im, Youngjae",Uncovering the Dark Patterns of Phishing Emails: An Eye-Tracking Analysis,IEEE Access,,2169-3536,10.1109/ACCESS.2025.3633616,,"Phishing emails are a representative form of dark patterns that visually deceive users and exploit psychological vulnerabilities. This study employed eye-tracking to empirically examine which features in phishing emails are most frequently overlooked. Two commonly encountered phishing categories—emails requiring immediate user action and those prompting account registration—were tested using prototypes modeled after Netflix and Adobe. Each email contained six widely recognized deceptive cues: fake sender address, generic greeting, urgent language, fake hyperlink, brand imitation, and false source assumption. Among these, brand imitation and urgent language received the least visual attention. These cues showed significantly lower fixation duration, fixation count, and revisit count. Paired t-tests revealed that these two cues were statistically less attended than the others (p \textless.001). Survey responses and heatmaps further confirmed the low detection rates for brand imitation and urgency cues. The findings suggest that visual trust cues (e.g., brand logos) and urgency-based persuasion techniques are particularly effective at bypassing user scrutiny. These results underscore critical perceptual blind spots and highlight the need for improved training and detection systems that incorporate human-computer interaction (HCI) perspectives, addressing subtle visual and psychological manipulation strategies beyond conventional technical indicators.",2025,20/03/2026 17:26,20/03/2026 18:21,,197634–197644,,,13,,,,,,,,,,,,,,,,,,,,,Dark patterns; Electronic mail; eye-tracking; Gaze tracking; human-computer interaction; Hypertext systems; Layout; Natural language processing; Phishing; phishing email; Prototypes; Psychology; Usability; user interface; Visualization,,,,,,,,,,,,,,,,,,,,,,,,,,,,,,,,,,,,,,,,,,,,,,,
Exclude,SXXKKTB7,conferencePaper,2024,"Choksi, Madiha Zahrah; Aubin Le Quéré, Marianne; Lloyd, Travis; Tao, Ruojia; Grimmelmann, James; Naaman, Mor",Under the (neighbor)hood: Hyperlocal Surveillance on Nextdoor,Proceedings of the 2024 CHI Conference on Human Factors in Computing Systems,979-8-4007-0330-0,,10.1145/3613904.3641967,https://doi.org/10.1145/3613904.3641967,"This paper examines the tensions between neighborhood gentrification and community surveillance posts on Nextdoor, a hyperlocal social media platform for neighborhoods. We created a privacy-preserving pipeline to gather research data from public Nextdoor posts in Atlanta, Georgia and filtered these to a dataset of 1,537 community surveillance posts. We developed a qualitative codebook to label observed patterns of community surveillance, and deploy a large language model to tag these posts at scale. Ultimately, we present an extensible and empirically-tested typology of the modes of community surveillance that occur on hyperlocal platforms. We find a complex relationship between community surveillance posts and neighborhood gentrification, which indicates that publicly disclosing information about perceived outsiders, especially for petty crimes, is most prevalent in gentrifying neighborhoods. Our empirical evidence inform critical perspectives which posit that community surveillance on platforms like Nextdoor can exclude and marginalize minoritized populations, particularly in gentrifying neighborhoods. Our findings carry broader implications for hyperlocal social platforms and their potential to amplify and exacerbate social tensions and exclusion.",2024,20/03/2026 17:26,20/03/2026 18:21,,,,,,,,,CHI '24,,,,Association for Computing Machinery,"New York, NY, USA",,,,,,,,,,,,City; Method; Online Communities; Privacy; Qualitative Methods; Quantitative Methods; Social Media; Theory,,,,,,,,,,,,,,,,,,,,,,,,,,,,,,,,,,,,,,,,,,,,,,,
Exclude,JA7ATMWX,journalArticle,2025,"Liu, Yuhan; Song, Emmy; Zhang, Owen Xingjian; Merriman, Jewel; Zhang, Lei; Monroy-Hernández, Andrés",Understanding Decentralized Social Feed Curation on Mastodon,Proc. ACM Hum.-Comput. Interact.,,,10.1145/3757688,https://doi.org/10.1145/3757688,"Amid rising concerns over moderation, algorithmic control, and platform governance on centralized social media, people are increasingly turning to decentralized alternatives like Mastodon to regain control over their feeds. This shift offers new opportunities to understand how people perceive and curate their feeds. We conducted a two-part study with 21 Mastodon users: first, interviews exploring how they perceive and manage their feeds; and second, a design probe study using BRAIDS.SOCIAL, a web-based feed curation prototype informed by the first part of our initial findings. We learned how seamful design can increase people's trust in algorithmic curation, and surfaced trade-offs people navigate between machine learning-based and rule-based filtering approaches. We also identify a core design tension in decentralized platforms: whether to support personalization through new applications or extensions layered atop existing ones.",2025-10,20/03/2026 17:26,20/03/2026 18:21,,,,7,9,,,,,,,,Association for Computing Machinery,"New York, NY, USA",,,,,,,,,,,,algorithmic feed; fediverse; mastodon; social media,,,,,,,,,,,,,,,,,,,,,,,,,,,,,,,,,,,,,,,,,,,,,,,
Exclude,DYKE8528,conferencePaper,2025,"Wood, Ryan; Brown, Chris",Understanding User Perceptions of Automated Dark Pattern Detection Online,2025 IEEE Symposium on Visual Languages and Human-Centric Computing (VL/HCC),,1943-6106,10.1109/VL-HCC65237.2025.00076,,"Dark patterns are software designs that manipulate and mislead users of applications or services. These patterns range from making it harder to end a subscription service, adding additional charges to a purchase, or having the user give out data or personal information. Prior work has explored perceptions of dark patterns, yet there is limited research exploring the effects of tooling to detect dark patterns on users. In this study, we introduce Dark Pattern Detector, a Chrome extension that would help users detect and understand dark patterns online. We conducted a technology probe study where participants (n=40) were tasked with installing the extension and completing a series of tasks on different websites based on real-world Internet browsing. We leveraged mixed-methods surveys to collect feedback on dark pattern detection tools in practice. We found the majority of participants gave positive feedback, claiming they found the extension useful, interesting, and a good idea. Many participants also gave useful feedback about what changes or additions they would like to see in future systems. With our results, we provide implications to help users better understand dark patterns and motivate future tools for enhancing dark pattern detection in online environments.",2025-10,20/03/2026 17:26,20/03/2026 18:21,,478–487,,,,,,,,,,,,,,,,,,,,,,,,Browser extension; Browsers; Dark Pattern Detection; Dark Patterns; Detectors; Internet; Knowledge engineering; Probes; Prototypes; Software design; Surveys; Technology probe; User interfaces; Visualization,,,,,,,,,,,,,,,,,,,,,,,,,,,,,,,,,,,,,,,,,,,,,,,
Exclude,H7MXXG35,conferencePaper,2025,"Liang, Huayu; Hossain, Syeda Afia Zahin; Brown, Chris",Understanding User and Developer Perceptions of and Responses to Dark Patterns in Online UIs,2025 IEEE Symposium on Visual Languages and Human-Centric Computing (VL/HCC),,1943-6106,10.1109/VL-HCC65237.2025.00030,,"As dependence on software applications grows, so are the persuasive designs that impact users’ experience and decision-making in online user interfaces (UIs). Dark patterns are UI design choices crafted to manipulate or trick users into actions that are not intended. Scholarship on dark patterns is vastly increasing-however, there is limited work on how dark patterns impact users’ perceptions and interaction with applications. Furthermore, research has yet to investigate dark patterns from the perspective of software engineers who implement UI designs. We explore users’ and developers’ perceptions of dark patterns using a mixed-methods approach, surveying each stakeholder group (N_\textbackslashtext user =66 and N_\textbackslashtext developer =38) and mining GitHub data (N=2556). Our findings reveal that dark patterns encountered online leave users with limited or no options for avoidance. Developers report that external pressures influence their decisions to implement dark patterns, and most recognize their adverse effects on trust and user experiences (UX), often reflecting negative sentiments in software projects. Our findings shed light on mitigating deceptive designs in online interfaces that are increasingly essential in people’s daily lives. Study artifacts-including surveys, GitHub data, and data collection scripts-are available online.11https://github.com/huayu1998/VL-HCC-2025-Study-on-Users-and-Developers-Perceptions-of-Dark-Patterns-Replication-Package.git",2025-10,20/03/2026 17:26,20/03/2026 18:21,,204–210,,,,,,,,,,,,,,,,,,,,,,,,Dark Patterns; Deceptive Design; Empirical Study; Ethics; Hands; Scholarships; Sentiment analysis; Sentiment Analysis; Software; Software development management; Stakeholders; Surveys; User interfaces; Visualization,,,,,,,,,,,,,,,,,,,,,,,,,,,,,,,,,,,,,,,,,,,,,,,
Exclude,VQ9TN67X,conferencePaper,2024,"Kim, Yoonsu; Lee, Jueon; Kim, Seoyoung; Park, Jaehyuk; Kim, Juho","Understanding Users’ Dissatisfaction with ChatGPT Responses: Types, Resolving Tactics, and the Effect of Knowledge Level",Proceedings of the 29th International Conference on Intelligent User Interfaces,979-8-4007-0508-3,,10.1145/3640543.3645148,https://doi.org/10.1145/3640543.3645148,"Large language models (LLMs) with chat-based capabilities, such as ChatGPT, are widely used in various workflows. However, due to a limited understanding of these large-scale models, users struggle to use this technology and experience different kinds of dissatisfaction. Researchers have introduced several methods, such as prompt engineering, to improve model responses. However, they focus on enhancing the model’s performance in specific tasks, and little has been investigated on how to deal with the user dissatisfaction resulting from the model’s responses. Therefore, with ChatGPT as the case study, we examine users’ dissatisfaction along with their strategies to address the dissatisfaction. After organizing users’ dissatisfaction with LLM into seven categories based on a literature review, we collected 511 instances of dissatisfactory ChatGPT responses from 107 users and their detailed recollections of dissatisfactory experiences, which we released as a publicly accessible dataset. Our analysis reveals that users most frequently experience dissatisfaction when ChatGPT fails to grasp their intentions, while they rate the severity of dissatisfaction related to accuracy the highest. We also identified four tactics users employ to address their dissatisfaction and their effectiveness. We found that users often do not use any tactics to address their dissatisfaction, and even when using tactics, 72% of dissatisfaction remained unresolved. Moreover, we found that users with low knowledge of LLMs tend to face more dissatisfaction on accuracy while they often put minimal effort in addressing dissatisfaction. Based on these findings, we propose design implications for minimizing user dissatisfaction and enhancing the usability of chat-based LLM.",2024,20/03/2026 17:26,20/03/2026 18:21,,385–404,,,,,,,IUI '24,,,,Association for Computing Machinery,"New York, NY, USA",,,,,,,,,,,,Chat-based LLM; ChatGPT; datasets; Knowledge-level; Large Language Models; Resolving tactics; User-side dissatisfaction,,,,,,,,,,,,,,,,,,,,,,,,,,,,,,,,,,,,,,,,,,,,,,,
Exclude,IJ9MBD3A,conferencePaper,2023,"Zhang, Lanyun; Zhan, Jiani; Yang, Jingyi; Kwok, Verena Wai Wan",Understanding the AI-intervened User Interfaces of Online Health Consultation Platforms,Proceedings of the 25th International Conference on Mobile Human-Computer Interaction,978-1-4503-9924-1,,10.1145/3565066.3608699,https://doi.org/10.1145/3565066.3608699,"This paper aims to investigate patient perceptions (i.e. social presence and trust) of online health consultation (OHC) interfaces with a focus on artificial intelligence (AI) intervention. It describes two studies, which are part of a larger body of research that aims to explore how AI interventions and their interfaces should be designed so that AI can better support the mobile health experience. Study 1 (n=10) was an interview study, which yielded four categories of design features of OHC interfaces. Three categories have been, or would be, strongly intervened by AI and were viewed to have influenced on user perceptions to different extents. Study 2 (n=18) focused on exploring one AI-intervened feature and found that the interface design of AI interventions influenced user perceptions. Our contributions to HCI include empirical insights into how interfaces of AI-intervened OHCs could influence the perceptions of their users, with design implications.",2023,20/03/2026 17:26,20/03/2026 18:21,,,,,,,,,MobileHCI '23 Companion,,,,Association for Computing Machinery,"New York, NY, USA",,,,,,,,,,,,,,,,,,,,,,,,,,,,,,,,,,,,,,,,,,,,,,,,,,,,,,,,,,,
For Consideration,Q4NTPCZF,journalArticle,2023,"Lee, Min Hun; Chew, Chong Jun",Understanding the Effect of Counterfactual Explanations on Trust and Reliance on AI for Human-AI Collaborative Clinical Decision Making,Proc. ACM Hum.-Comput. Interact.,,,10.1145/3610218,https://doi.org/10.1145/3610218,"Artificial intelligence (AI) is increasingly being considered to assist human decision-making in high-stake domains (e.g. health). However, researchers have discussed an issue that humans can over-rely on wrong suggestions of the AI model instead of achieving human AI complementary performance. In this work, we utilized salient feature explanations along with what-if, counterfactual explanations to make humans review AI suggestions more analytically to reduce overreliance on AI and explored the effect of these explanations on trust and reliance on AI during clinical decision-making. We conducted an experiment with seven therapists and ten laypersons on the task of assessing post-stroke survivors' quality of motion, and analyzed their performance, agreement level on the task, and reliance on AI without and with two types of AI explanations. Our results showed that the AI model with both salient features and counterfactual explanations assisted therapists and laypersons to improve their performance and agreement level on the task when 'right' AI outputs are presented. While both therapists and laypersons over-relied on 'wrong' AI outputs, counterfactual explanations assisted both therapists and laypersons to reduce their over-reliance on 'wrong' AI outputs by 21% compared to salient feature explanations. Specifically, laypersons had higher performance degrades by 18.0 f1-score with salient feature explanations and 14.0 f1-score with counterfactual explanations than therapists with performance degrades of 8.6 and 2.8 f1-scores respectively. Our work discusses the potential of counterfactual explanations to better estimate the accuracy of an AI model and reduce over-reliance on 'wrong' AI outputs and implications for improving human-AI collaborative decision-making.",2023-10,20/03/2026 17:26,20/03/2026 18:21,,,,CSCW2,7,,,,,,,,Association for Computing Machinery,"New York, NY, USA",,,,,,,,,,,,clinical decision support systems; explainable AI; human centered AI; human-AI collaboration; physical stroke rehabilitation assessment; reliance; trust,,,,,,,,,,,,,,,,,,,,,,,,,,,,,,,,,,,,,,,,,,,,,,,
Exclude,LIJQGQDZ,journalArticle,2024,"Guo, Linge",Unmasking the shadows of AI: Investigating deceptive capabilities in Large Language Models,,,,,,"This research critically navigates the intricate landscape of AI deception, concentrating on deceptive behaviours of Large Language Models (LLMs). My objective is to elucidate this issue, examine the discourse surrounding it, and subsequently delve into its categorization and ramifications. The essay initiates with an evaluation of the AI Safety Summit 2023 (ASS) and introduction of LLMs, emphasising multidimensional biases that underlie their deceptive behaviours.The literature review covers four types of deception categorised: Strategic deception, Imitation, Sycophancy, and Unfaithful Reasoning, along with the social implications and risks they entail. Lastly, I take an evaluative stance on various aspects related to navigating the persistent challenges of the deceptive AI. This encompasses considerations of international collaborative governance, the reconfigured engagement of individuals with AI, proposal of practical adjustments, and specific elements of digital education.",2024-02,20/03/2026 17:26,20/03/2026 18:21,,,,,,,,,,,,,,,,http://creativecommons.org/publicdomain/zero/1.0/,,,,,,,,,,,,,,,,,,,,,,,,,,,,,,,,,,,,,,,,,,,,,,,,,,,,,,,,,
Exclude,RTYG33HN,conferencePaper,2025,"Balayn, Agathe; Yurrita, Mireia; Rancourt, Fanny; Casati, Fabio; Gadiraju, Ujwal",Unpacking Trust Dynamics in the LLM Supply Chain: An Empirical Exploration to Foster Trustworthy LLM Production &amp; Use,Proceedings of the 2025 CHI Conference on Human Factors in Computing Systems,979-8-4007-1394-1,,10.1145/3706598.3713787,https://doi.org/10.1145/3706598.3713787,"Research on trust in AI is limited to several trustors (e.g., end-users) and trustees (especially AI systems), and empirical explorations remain in laboratory settings, overlooking factors that impact trust relations in the real world. Here, we broaden the scope of research by accounting for the supply chains that AI systems are part of. To this end, we present insights from an in-situ, empirical, study of LLM supply chains. We conducted interviews with 71 practitioners, and analyzed their (collaborative) practices using the lens of trust drawing from literature in organizational psychology. Our work reveals complex trust dynamics at the junctions of the chains, with interactions between diverse technical artifacts, individuals, or organizations. These junctions might constitute terrain for uncalibrated reliance when trustors lack supply chain knowledge or power dynamics are at play. Our findings bear implications for AI researchers and policymakers to promote AI governance that fosters calibrated trust.",2025,20/03/2026 17:26,20/03/2026 18:21,,,,,,,,,CHI '25,,,,Association for Computing Machinery,"New York, NY, USA",,,,,,,,,,,,AI supply chain; calibrated trust; collaborations; large language models; trust in AI,,,,,,,,,,,,,,,,,,,,,,,,,,,,,,,,,,,,,,,,,,,,,,,
Exclude,56PTIUCM,journalArticle,2025,"Marioriyad, Arash; Adim, Shaygan; Alighardashi, Nima; Banghshah, Mahdieh Soleymani; Rohban, Mohammad Hossein",Unspoken hints: Accuracy without acknowledgement in LLM reasoning,,,,,,"Large language models (LLMs) increasingly rely on chain-of-thought (CoT) prompting to solve mathematical and logical reasoning tasks. Yet, a central question remains: to what extent are these generated rationales \textbackslashtextbackslashemph{faithful} to the underlying computations, rather than post-hoc narratives shaped by hints that function as answer shortcuts embedded in the prompt? Following prior work on hinted vs.\textbackslashtextbackslash unhinted prompting, we present a systematic study of CoT faithfulness under controlled hint manipulations. Our experimental design spans four datasets (AIME, GSM-Hard, MATH-500, UniADILR), two state-of-the-art models (GPT-4o and Gemini-2-Flash), and a structured set of hint conditions varying in correctness (correct and incorrect), presentation style (sycophancy and data leak), and complexity (raw answers, two-operator expressions, four-operator expressions). We evaluate both task accuracy and whether hints are explicitly acknowledged in the reasoning. Our results reveal three key findings. First, correct hints substantially improve accuracy, especially on harder benchmarks and logical reasoning, while incorrect hints sharply reduce accuracy in tasks with lower baseline competence. Second, acknowledgement of hints is highly uneven: equation-based hints are frequently referenced, whereas raw hints are often adopted silently, indicating that more complex hints push models toward verbalizing their reliance in the reasoning process. Third, presentation style matters: sycophancy prompts encourage overt acknowledgement, while leak-style prompts increase accuracy but promote hidden reliance. This may reflect RLHF-related effects, as sycophancy exploits the human-pleasing side and data leak triggers the self-censoring side. Together, these results demonstrate that LLM reasoning is systematically shaped by shortcuts in ways that obscure faithfulness.",2025-10,20/03/2026 17:26,20/03/2026 18:21,,,,,,,,,,,,,,,,http://creativecommons.org/licenses/by-sa/4.0/,,,,,,,,,,,,,,,,,,,,,,,,,,,,,,,,,,,,,,,,,,,,,,,,,,,,,,,,,
Exclude,B23HGP3G,conferencePaper,2024,"Kirthiga, N.; Reddy, Bommana Manideep; Mahalakshmi, Boggavarapu Siri; Risthitha, Bethala; Teja, Dammalapa",Unveiling the Dark Patterns in E-Commerce Web Sites,2024 International Conference on Sustainable Communication Networks and Application (ICSCNA),,,10.1109/ICSCNA63714.2024.10864071,,"This research study investigates the prevalence and impact of “dark patterns” in the digital world. Dark patterns are deceptive design techniques employed by websites and applications to manipulate user behavior and induce actions that may not be in the user's best interest. This study examines the various forms of dark patterns, analyzes their impact on user autonomy and trust, and explores potential strategies to mitigate their use. By raising awareness about dark patterns and developing effective countermeasures, we can create a more ethical and trustworthy digital environment for all users.",2024-12,20/03/2026 17:26,20/03/2026 18:21,,635–640,,,,,,,,,,,,,,,,,,,,,,,,Costs; Dark Patterns; Data Exploration; Decision making; Digital Ethics; Electronic commerce; Ethics; Fake news; Forestry; Green communications; Isolation Forest Algorithm; Knowledge engineering; Switches; User Experience; Web sites,,,,,,,,,,,,,,,,,,,,,,,,,,,,,,,,,,,,,,,,,,,,,,,
Exclude,9UCEGEUP,journalArticle,2026,"Noshin, Kazi; Ahmed, Syed Ishtiaque; Sultana, Sharifa",User detection and response patterns of sycophantic behavior in conversational AI,,,,,,"While concerns about LLM sycophancy have grown among researchers and developers, how users themselves experience this behavior remains largely unexplored. We analyze Reddit discussions to investigate how users detect, mitigate, and perceive sycophantic AI. We develop the DCR epistemology that maps user experiences across three stages: observing sycophantic behaviors, detecting sycophancy, and responding to these behaviors. Our findings reveal that users employ various detection techniques, including cross-platform comparison and inconsistency testing. We document diverse mitigation approaches, including persona-based prompts and targeted language patterns in prompt engineering. We find sycophancy's effects are context-dependent rather than universally harmful. Specifically, vulnerable populations experiencing trauma, mental health challenges, or isolation actively seek and value sycophantic behaviors as emotional support. Users develop both technical and folk explanations for why sycophancy occurs. These findings challenge the assumption that sycophancy should be eliminated universally. We conclude by proposing context-aware AI design that balances risks with benefits of affirmative interaction, while discussing implications for user education and transparency.",2026-03,20/03/2026 17:26,20/03/2026 18:21,,,,,,,,,,,,,,,,http://arxiv.org/licenses/nonexclusive-distrib/1.0/,,,,,,,,,,,,,,,,,,,,,,,,,,,,,,,,,,,,,,,,,,,,,,,,,,,,,,,,,
