Reviewer_Decision,Key,Item Type,Publication Year,Author,Title,Publication Title,ISBN,ISSN,DOI,Url,Abstract Note,Date,Date Added,Date Modified,Access Date,Pages,Num Pages,Issue,Volume,Number Of Volumes,Journal Abbreviation,Short Title,Series,Series Number,Series Text,Series Title,Publisher,Place,Language,Rights,Type,Archive,Archive Location,Library Catalog,Call Number,Extra,Notes,File Attachments,Link Attachments,Manual Tags,Automatic Tags,Editor,Series Editor,Translator,Contributor,Attorney Agent,Book Author,Cast Member,Commenter,Composer,Cosponsor,Counsel,Interviewer,Producer,Recipient,Reviewed Author,Scriptwriter,Words By,Guest,Number,Edition,Running Time,Scale,Medium,Artwork Size,Filing Date,Application Number,Assignee,Issuing Authority,Country,Meeting Name,Conference Name,Court,References,Reporter,Legal Status,Priority Numbers,Programming Language,Version,System,Code,Code Number,Section,Session,Committee,History,Legislative Body
Exclude,FZQIPXIG,journalArticle,2024,"Khan, Arifa; Saravanan, P; Venkatesan, S K",Social evolution of published text and the emergence of artificial intelligence through Large Language Models and the problem of toxicity and bias,,,,,,"We provide a birds eye view of the rapid developments in AI and Deep Learning that has led to the path-breaking emergence of AI in Large Language Models. The aim of this study is to place all these developments in a pragmatic broader historical social perspective without any exaggerations while at the same time without any pessimism that created the AI winter in the 1970s to 1990s. We also at the same time point out toxicity, bias, memorization, sycophancy, logical inconsistencies, hallucinations that exist just as a warning to the overly optimistic. We note here that just as this emergence of AI seems to occur at a threshold point in the number of neural connections or weights, it has also been observed that human brain and especially the cortex region is nothing special or extraordinary but simply a case of scaled-up version of the primate brain and that even the human intelligence seems like an emergent phenomena of scale.",2024-02,20/03/2026 17:26,20/03/2026 18:21,,,,,,,,,,,,,,,,http://creativecommons.org/licenses/by-sa/4.0/,,,,,,,,,,,,,,,,,,,,,,,,,,,,,,,,,,,,,,,,,,,,,,,,,,,,,,,,,
For Consideration,JDBP3DGS,conferencePaper,2025,"Huang, Yue; Chen, Canyu; Cheng, Lu; Kailkhura, Bhavya; Chawla, Nitesh; Zhang, Xiangliang","Socially Responsible and Trustworthy Generative Foundation Models: Principles, Challenges, and Practices",Proceedings of the 34th ACM International Conference on Information and Knowledge Management,979-8-4007-2040-6,,10.1145/3746252.3761448,https://doi.org/10.1145/3746252.3761448,"Generative foundation models (GenFMs), including large language and multimodal models, are transforming information retrieval and knowledge management. However, their rapid adoption raises urgent concerns about social responsibility, trustworthiness, and governance. This tutorial offers a comprehensive, hands-on overview of recent advances in responsible GenFMs, covering foundational concepts, multi-dimensional risk taxonomies (including safety, privacy, robustness, truthfulness, fairness, and machine ethics), state-of-the-art evaluation benchmarks, and effective mitigation strategies. We integrate real-world case studies and practical exercises using open-source tools, and present key perspectives from both policy and industry, including recent regulatory developments and enterprise practices. The session concludes with a discussion of open challenges, providing actionable guidance for the CIKM community.",2025,20/03/2026 17:26,20/03/2026 18:21,,6825–6828,,,,,,,CIKM '25,,,,Association for Computing Machinery,"New York, NY, USA",,,,,,,,,,,,foundation model; generative ai; responsible ai,,,,,,,,,,,,,,,,,,,,,,,,,,,,,,,,,,,,,,,,,,,,,,,
Exclude,NYQ3N4NF,conferencePaper,2023,"Ferguson, Sharon A; Aoyagui, Paula Akemi; Kuzminykh, Anastasia",Something Borrowed: Exploring the Influence of AI-Generated Explanation Text on the Composition of Human Explanations,Extended Abstracts of the 2023 CHI Conference on Human Factors in Computing Systems,978-1-4503-9422-2,,10.1145/3544549.3585727,https://doi.org/10.1145/3544549.3585727,"Recent advances in Human-AI interaction have highlighted the possibility of employing AI in collaborative decision-making contexts, particularly in cases where the decision is subjective, without one ground truth. In these contexts, researchers argue that AI could be used not just to provide a final decision recommendation, but to surface new perspectives, rationales, and insights. In this late-breaking work, we describe the initial findings from an empirical study investigating how complementary AI input influences humans’ rationale in ambiguous decision-making. We use subtle sexism as an example of this context, and GPT-3 to create explanation-like text. We find that participants change the language, level of detail, and even the argumentative stance of their explanations after seeing the AI explanation text. They often borrow language directly from this complementary text. We discuss the implications for collaborative decision-making and the next steps in this research agenda.",2023,20/03/2026 17:26,20/03/2026 18:21,,,,,,,,,CHI EA '23,,,,Association for Computing Machinery,"New York, NY, USA",,,,,,,,,,,,Explainable AI; GPT-3; Human Explanations; Human-AI Collaboration; User Study,,,,,,,,,,,,,,,,,,,,,,,,,,,,,,,,,,,,,,,,,,,,,,,
Include,UJP7VSBU,conferencePaper,2023,"Kraus, Johannes Maria; Merger, Julia; Gröner, Felix; Pätz, Jessica",Sorry' Says the Robot: The Tendency to Anthropomorphize and Technology Affinity Affect Trust in Repair Strategies after Error,Companion of the 2023 ACM/IEEE International Conference on Human-Robot Interaction,978-1-4503-9970-8,,10.1145/3568294.3580122,https://doi.org/10.1145/3568294.3580122,"This research investigates how six different trust repair strategies (apologies, explanations and denial) of a robot packing lunch bags affect trust after an error and how user dispositions predict trust in the repair strategies. In an online experiment, the perceived trustworthiness was assessed in a within-subjects design (N = 604) in which all strategies were evaluated in direct comparison. Higher trustworthiness of an apology (vs. no apology) and of a technical explanation for an error (vs. an empty and an anthropomorphic explanation) was found. In line with theoretical considerations, user personality was found to be associated with trust in specific strategies. A higher tendency to anthropomorphize technology was associated with higher trust in an anthropomorphic explanation and technological affinity was associated with a higher trust in the technical explanation. Taken together, personalization of trust repair strategies is a promising direction for individualized design to foster trustworthy human-robot interaction.",2023,20/03/2026 17:26,20/03/2026 18:21,,436–441,,,,,,,HRI '23,,,,Association for Computing Machinery,"New York, NY, USA",,,,,,,,,,,,errors; personality; reliability; trust; trust repair strategies,,,,,,,,,,,,,,,,,,,,,,,,,,,,,,,,,,,,,,,,,,,,,,,
Exclude,G9UK7ACN,conferencePaper,2025,"Chen, Zeya; Wen, Jianing; Li, Toby Jia-Jun; Yao, Yaxing; Li, Tianshi",Speculating Unintended Creepiness: Exploring LLM-Powered Empathy Building for Privacy-Aware UX Design,Proceedings of the 2025 Workshop on Human-Centered AI Privacy and Security,979-8-4007-1905-9,,10.1145/3733816.3760759,https://doi.org/10.1145/3733816.3760759,"Despite increasing awareness of dark patterns and anti-patterns in UX design, privacy invasive design choices remain prevalent in real world systems. These choices often stem not from malicious intent, but from a lack of structured guidance and contextual understanding among designers. Designers face challenges not only in detecting deceptive interactions, but also in anticipating how certain features may cause harm. Contributing factors such as limited ability to recognize harm, lack of relatable design references, and challenges in connecting abstract privacy principles to concrete design scenarios, particularly when designing for non-dominant user groups. To address this, while currently implemented as a pipeline, PrivacyMotiv is envisioned as a future system that integrates user personas, journey maps, and design audits into a unified tool to help designers identify privacy harms and dark patterns. Grounded in motivation theory and contextual design thinking, our approach supports reasoning across multiple user-feature interactions situated in real world scenarios, with the goal of revealing hidden risks and inspiring designer empathy to promote privacy-aware design for everyone.",2025,20/03/2026 17:26,20/03/2026 18:21,,101–125,,,,,,,HAIPS '25,,,,Association for Computing Machinery,"New York, NY, USA",,,,,,,,,,,,Empathy; Human-centered AI; Privacy; UX Design,,,,,,,,,,,,,,,,,,,,,,,,,,,,,,,,,,,,,,,,,,,,,,,
For Consideration,MQ5WC6BK,conferencePaper,2024,"Sheil, Ashley; Acar, Gunes; Schraffenberger, Hanna; Gellert, Raphael; Malone, David",Staying at the Roach Motel: Cross-Country Analysis of Manipulative Subscription and Cancellation Flows,Proceedings of the 2024 CHI Conference on Human Factors in Computing Systems,979-8-4007-0330-0,,10.1145/3613904.3642881,https://doi.org/10.1145/3613904.3642881,"Subscribing to online services is typically a straightforward process, but cancelling them can be arduous and confusing — causing many to resign and continue paying for services they no longer use. Making the cancellation process intentionally difficult is recognized as a dark pattern called Roach Motel. This paper characterizes the subscription and cancellation flows of popular news websites from four different countries, and discusses them in the context of recent regulatory changes. We study the design features that make it difficult to cancel a subscription and find several cancellation flows that feature intentional barriers, such as forcing users to call a representative or type in a phrase. Further, we find many subscription flows that do not adequately inform users about recurring charges. Our results point to a growing need for effective regulation of designs that trick, coerce, or manipulate users into paying for subscriptions they do not want.",2024,20/03/2026 17:26,20/03/2026 18:21,,,,,,,,,CHI '24,,,,Association for Computing Machinery,"New York, NY, USA",,,,,,,,,,,,Dark Patterns; Deceptive Designs; Newspapers; Roach Motel; Subscriptions,,,,,,,,,,,,,,,,,,,,,,,,,,,,,,,,,,,,,,,,,,,,,,,
Exclude,TFFAWRV6,journalArticle,2025,"Xu, Zhiyuan; Abaimov, Stanislav; Gardiner, Joseph; Belguith, Sana",Steering in the shadows: Causal amplification for activation space attacks in large language models,,,,,,"Modern large language models (LLMs) are typically secured by auditing data, prompts, and refusal policies, while treating the forward pass as an implementation detail. We show that intermediate activations in decoder-only LLMs form a vulnerable attack surface for behavioral control. Building on recent findings on attention sinks and compression valleys, we identify a high-gain region in the residual stream where small, well-aligned perturbations are causally amplified along the autoregressive trajectory–a Causal Amplification Effect (CAE). We exploit this as an attack surface via Sensitivity-Scaled Steering (SSS), a progressive activation-level attack that combines beginning-of-sequence (BOS) anchoring with sensitivity-based reinforcement to focus a limited perturbation budget on the most vulnerable layers and tokens. We show that across multiple open-weight models and four behavioral axes, SSS induces large shifts in evil, hallucination, sycophancy, and sentiment while preserving high coherence and general capabilities, turning activation steering into a concrete security concern for white-box and supply-chain LLM deployments.",2025-11,20/03/2026 17:26,20/03/2026 18:21,,,,,,,,,,,,,,,,http://creativecommons.org/licenses/by/4.0/,,,,,,,,,,,,,,,,,,,,,,,,,,,,,,,,,,,,,,,,,,,,,,,,,,,,,,,,,
For Consideration,7C24AEEP,journalArticle,2026,"Fierro, Constanza; Roger, Fabien",Steering language models with weight arithmetic,,,,,,"Providing high-quality feedback to Large Language Models (LLMs) on a diverse training distribution can be difficult and expensive, and providing feedback only on a narrow distribution can result in unintended generalizations. To better leverage narrow training data, we propose contrastive weight steering, a simple post-training method that edits the model parameters using weight arithmetic. We isolate a behavior direction in weight-space by subtracting the weight deltas from two small fine-tunes – one that induces the desired behavior and another that induces its opposite – and then add or remove this direction to modify the model's weights. We apply this technique to mitigate sycophancy and induce misalignment, and find that weight steering often generalizes further than activation steering, achieving stronger out-of-distribution behavioral control before degrading general capabilities. We also show that, in the context of task-specific fine-tuning, weight steering can partially mitigate undesired behavioral drift: it can reduce sycophancy and under-refusals introduced during fine-tuning while preserving task performance gains. Finally, we provide preliminary evidence that emergent misalignment can be detected by measuring the similarity between fine-tuning updates and an “evil” weight direction, suggesting that it may be possible to monitor the evolution of weights during training and detect rare misaligned behaviors that never manifest during training or evaluations.",2026-02,20/03/2026 17:26,20/03/2026 18:21,,,,,,,,,,,,,,,,http://creativecommons.org/licenses/by/4.0/,,,,,,,,,,,,,,,,,,,,,,,,,,,,,,,,,,,,,,,,,,,,,,,,,,,,,,,,,
Exclude,YZTCUGNW,conferencePaper,2025,"Mandai, Yuto; Seaborn, Katie; Nakano, Tomoyasu; Sun, Xin; Wang, Yijia; Kato, Jun","Super Kawaii Vocalics: Amplifying the ""Cute"" Factor in Computer Voice",Proceedings of the 2025 CHI Conference on Human Factors in Computing Systems,979-8-4007-1394-1,,10.1145/3706598.3713709,https://doi.org/10.1145/3706598.3713709,"“Kawaii” is the Japanese concept of cute, which carries sociocultural connotations related to social identities and emotional responses. Yet, virtually all work to date has focused on the visual side of kawaii, including in studies of computer agents and social robots. In pursuit of formalizing the new science of kawaii vocalics, we explored what elements of voice relate to kawaii and how they might be manipulated, manually and automatically. We conducted a four-phase study (grand N = 512) with two varieties of computer voices: text-to-speech (TTS) and game character voices. We found kawaii “sweet spots” through manipulation of fundamental and formant frequencies, but only for certain voices and to a certain extent. Findings also suggest a ceiling effect for the kawaii vocalics of certain voices. We offer empirical validation of the preliminary kawaii vocalics model and an elementary method for manipulating kawaii perceptions of computer voice.",2025,20/03/2026 17:26,20/03/2026 18:21,,,,,,,,,CHI '25,,,,Association for Computing Machinery,"New York, NY, USA",,,,,,,,,,,,Character Design; Computer Voice; Japan; Kawaii; Kawaii Computing; Speech Signal Processing; Video Games; Voice Assistants; Voice Interaction,,,,,,,,,,,,,,,,,,,,,,,,,,,,,,,,,,,,,,,,,,,,,,,
For Consideration,TM5T8TE4,conferencePaper,2025,"Chen, Meng; Iyer, Akhil; Pavel, Amy",Surfacing Variations to Calibrate Perceived Reliability of MLLM-generated Image Descriptions,Proceedings of the 27th International ACM SIGACCESS Conference on Computers and Accessibility,979-8-4007-0676-9,,10.1145/3663547.3746393,https://doi.org/10.1145/3663547.3746393,"Multimodal large language models (MLLMs) provide new opportunities for blind and low vision (BLV) people to access visual information in their daily lives. However, these models often produce errors that are difficult to detect without sight, posing safety and social risks in scenarios from medication identification to outfit selection. While BLV MLLM users use creative workarounds such as cross-checking between tools and consulting sighted individuals, these approaches are often time-consuming and impractical. We explore how systematically surfacing variations across multiple MLLM responses can support BLV users to detect unreliable information without visually inspecting the image. We contribute a design space for eliciting and presenting variations in MLLM descriptions, a prototype system implementing three variation presentation styles, and findings from a user study with 15 BLV participants. Our results demonstrate that presenting variations significantly increases users’ ability to identify unreliable claims (by 4.9x using our approach compared to single descriptions) and significantly decreases perceived reliability of MLLM responses. 14 of 15 participants preferred seeing variations of MLLM responses over a single description, and all expressed interest in using our system for tasks from understanding a tornado’s path to posting an image on social media.",2025,20/03/2026 17:26,20/03/2026 18:21,,,,,,,,,ASSETS '25,,,,Association for Computing Machinery,"New York, NY, USA",,,,,,,,,,,,Accessibility; AI Errors; Image Descriptions; Multimodal Large Language Models; Trust; Variations,,,,,,,,,,,,,,,,,,,,,,,,,,,,,,,,,,,,,,,,,,,,,,,
Exclude,WBF44X86,journalArticle,2026,"Guo, Longjie; Yuan, Chenjie; Zhong, Mingyuan; Wolfe, Robert; Zhong, Ruican; Xu, Yue; Wen, Bingbing; Shen, Hua; Wang, Lucy Lu; Hiniker, Alexis",SusBench: An online benchmark for evaluating dark pattern susceptibility of computer-use agents,,,,,,"As LLM-based computer-use agents (CUAs) begin to autonomously interact with real-world interfaces, understanding their vulnerability to manipulative interface designs becomes increasingly critical. We introduce SusBench, an online benchmark for evaluating the susceptibility of CUAs to UI dark patterns, designs that aim to manipulate or deceive users into taking unintentional actions. Drawing nine common dark pattern types from existing taxonomies, we developed a method for constructing believable dark patterns on real-world consumer websites through code injections, and designed 313 evaluation tasks across 55 websites. Our study with 29 participants showed that humans perceived our dark pattern injections to be highly realistic, with the vast majority of participants not noticing that these had been injected by the research team. We evaluated five state-of-the-art CUAs on the benchmark. We found that both human participants and agents are particularly susceptible to the dark patterns of Preselection, Trick Wording, and Hidden Information, while being resilient to other overt dark patterns. Our findings inform the development of more trustworthy CUAs, their use as potential human proxies in evaluating deceptive designs, and the regulation of an online environment increasingly navigated by autonomous agents.",2026-02,20/03/2026 17:26,20/03/2026 18:21,,,,,,,,,,,,,,,,http://creativecommons.org/licenses/by/4.0/,,,,,,,,,,,,,,,,,,,,,,,,,,,,,,,,,,,,,,,,,,,,,,,,,,,,,,,,,
For Consideration,4WNR6WY6,journalArticle,2025,"Fanous, Aaron; Goldberg, Jacob; Agarwal, Ank A; Lin, Joanna; Zhou, Anson; Daneshjou, Roxana; Koyejo, Sanmi",SycEval: Evaluating LLM Sycophancy,,,,,,"Large language models (LLMs) are increasingly applied in educational, clinical, and professional settings, but their tendency for sycophancy – prioritizing user agreement over independent reasoning – poses risks to reliability. This study introduces a framework to evaluate sycophantic behavior in ChatGPT-4o, Claude-Sonnet, and Gemini-1.5-Pro across AMPS (mathematics) and MedQuad (medical advice) datasets. Sycophantic behavior was observed in 58.19% of cases, with Gemini exhibiting the highest rate (62.47%) and ChatGPT the lowest (56.71%). Progressive sycophancy, leading to correct answers, occurred in 43.52% of cases, while regressive sycophancy, leading to incorrect answers, was observed in 14.66%. Preemptive rebuttals demonstrated significantly higher sycophancy rates than in-context rebuttals (61.75% vs. 56.52%, Z=5.87, p\textless0.001), particularly in computational tasks, where regressive sycophancy increased significantly (preemptive: 8.13%, in-context: 3.54%, p\textless0.001). Simple rebuttals maximized progressive sycophancy (Z=6.59, p\textless0.001), while citation-based rebuttals exhibited the highest regressive rates (Z=6.59, p\textless0.001). Sycophantic behavior showed high persistence (78.5%, 95% CI: [77.2%, 79.8%]) regardless of context or model. These findings emphasize the risks and opportunities of deploying LLMs in structured and dynamic domains, offering insights into prompt programming and model optimization for safer AI applications.",2025-09,20/03/2026 17:26,20/03/2026 18:21,,,,,,,,,,,,,,,,http://creativecommons.org/licenses/by-nc-nd/4.0/,,,,,,,,,,,,,,,,,,,,,,,,,,,,,,,,,,,,,,,,,,,,,,,,,,,,,,,,,
Exclude,4TZGE9IR,journalArticle,2026,"Peng, Dongshen; Wang, Yi; Schoeffler, Austin; Preiksaitis, Carl; Rose, Christian",SycoEval-EM: Sycophancy evaluation of large language models in simulated clinical encounters for emergency care,,,,,,"Large language models (LLMs) show promise in clinical decision support yet risk acquiescing to patient pressure for inappropriate care. We introduce SycoEval-EM, a multi-agent simulation framework evaluating LLM robustness through adversarial patient persuasion in emergency medicine. Across 20 LLMs and 1,875 encounters spanning three Choosing Wisely scenarios, acquiescence rates ranged from 0-100%. Models showed higher vulnerability to imaging requests (38.8%) than opioid prescriptions (25.0%), with model capability poorly predicting robustness. All persuasion tactics proved equally effective (30.0-36.0%), indicating general susceptibility rather than tactic-specific weakness. Our findings demonstrate that static benchmarks inadequately predict safety under social pressure, necessitating multi-turn adversarial testing for clinical AI certification.",2026-03,20/03/2026 17:26,20/03/2026 18:21,,,,,,,,,,,,,,,,http://creativecommons.org/licenses/by/4.0/,,,,,,,,,,,,,,,,,,,,,,,,,,,,,,,,,,,,,,,,,,,,,,,,,,,,,,,,,
Exclude,VJN9XP8P,journalArticle,2025,"Beigi, Mohammad; Shen, Ying; Shojaee, Parshin; Wang, Qifan; Wang, Zichao; Reddy, Chandan; Jin, Ming; Huang, Lifu",Sycophancy Mitigation through reinforcement learning with uncertainty-aware Adaptive Reasoning Trajectories,,,,,,"Despite the remarkable capabilities of large language models, current training paradigms inadvertently foster \textbackslashtextbackslashtextit{sycophancy}, i.e., the tendency of a model to agree with or reinforce user-provided information even when it's factually incorrect. To address this challenge, we introduce \textbackslashtextbackslashtextbf{SMART} (Sycophancy Mitigation through Adaptive Reasoning Trajectories), which reframes sycophancy as a \textbackslashtextbackslashtextit{reasoning optimization problem} rather than an output alignment issue. SMART is a two-stage framework comprising: (1) Uncertainty-Aware Adaptive Monte Carlo Tree Search (UA-MCTS), which dynamically adjusts model exploration based on state-level uncertainty to collect high-quality, diverse reasoning trajectories alongside both stepwise progress and final outcome rewards; and (2) progress-based reinforcement learning, which fine-tunes the model using the collected trajectories and reward signals to reinforce effective reasoning patterns. Through extensive experiments, we show that SMART significantly reduces sycophantic behavior while preserving strong performance on out-of-distribution inputs and maintaining general capabilities. These results underscore the importance of optimizing internal reasoning mechanisms to build more truthful and aligned AI assistants.",2025-09,20/03/2026 17:26,20/03/2026 18:21,,,,,,,,,,,,,,,,http://arxiv.org/licenses/nonexclusive-distrib/1.0/,,,,,,,,,,,,,,,,,,,,,,,,,,,,,,,,,,,,,,,,,,,,,,,,,,,,,,,,,
Exclude,RTADP3WK,journalArticle,2025,"Jain, Shreyans; Yost, Alexandra; Abdullah, Amirali",Sycophancy as compositions of Atomic Psychometric Traits,,,,,,"Sycophancy is a key behavioral risk in LLMs, yet is often treated as an isolated failure mode that occurs via a single causal mechanism. We instead propose modeling it as geometric and causal compositions of psychometric traits such as emotionality, openness, and agreeableness - similar to factor decomposition in psychometrics. Using Contrastive Activation Addition (CAA), we map activation directions to these factors and study how different combinations may give rise to sycophancy (e.g., high extraversion combined with low conscientiousness). This perspective allows for interpretable and compositional vector-based interventions like addition, subtraction and projection; that may be used to mitigate safety-critical behaviors in LLMs.",2025-08,20/03/2026 17:26,20/03/2026 18:21,,,,,,,,,,,,,,,,http://creativecommons.org/licenses/by/4.0/,,,,,,,,,,,,,,,,,,,,,,,,,,,,,,,,,,,,,,,,,,,,,,,,,,,,,,,,,
