Reviewer_Decision,Key,Item Type,Publication Year,Author,Title,Publication Title,ISBN,ISSN,DOI,Url,Abstract Note,Date,Date Added,Date Modified,Access Date,Pages,Num Pages,Issue,Volume,Number Of Volumes,Journal Abbreviation,Short Title,Series,Series Number,Series Text,Series Title,Publisher,Place,Language,Rights,Type,Archive,Archive Location,Library Catalog,Call Number,Extra,Notes,File Attachments,Link Attachments,Manual Tags,Automatic Tags,Editor,Series Editor,Translator,Contributor,Attorney Agent,Book Author,Cast Member,Commenter,Composer,Cosponsor,Counsel,Interviewer,Producer,Recipient,Reviewed Author,Scriptwriter,Words By,Guest,Number,Edition,Running Time,Scale,Medium,Artwork Size,Filing Date,Application Number,Assignee,Issuing Authority,Country,Meeting Name,Conference Name,Court,References,Reporter,Legal Status,Priority Numbers,Programming Language,Version,System,Code,Code Number,Section,Session,Committee,History,Legislative Body
Exclude,IGSM6G99,journalArticle,2025,"Wichers, Nevan; Ebtekar, Aram; Azarbal, Ariana; Gillioz, Victor; Ye, Christine; Ryd, Emil; Rathi, Neil; Sleight, Henry; Mallen, Alex; Roger, Fabien; Marks, Samuel",Inoculation Prompting: Instructing LLMs to misbehave at train-time improves test-time alignment,,,,,,"Large language models are sometimes trained with imperfect oversight signals, leading to undesired behaviors such as reward hacking and sycophancy. Improving oversight quality can be expensive or infeasible, motivating methods that improve learned behavior despite an imperfect training signal. We introduce Inoculation Prompting (IP), a simple but counterintuitive technique that prevents learning of an undesired behavior by modifying training prompts to explicitly request it. For example, to inoculate against reward hacking, we modify the prompts used in supervised fine-tuning to request code that only works on provided test cases but fails on other inputs. Across four settings we find that IP reduces the learning of undesired behavior without substantially reducing the learning of desired capabilities. We also show that prompts which more strongly elicit the undesired behavior prior to fine-tuning more effectively inoculate against the behavior when used during training; this serves as a heuristic to identify promising inoculation prompts. Overall, IP is a simple yet effective way to control how models generalize from fine-tuning, preventing learning of undesired behaviors without substantially disrupting desired capabilities.",2025-10,20/03/2026 17:26,20/03/2026 18:21,,,,,,,,,,,,,,,,http://creativecommons.org/licenses/by/4.0/,,,,,,,,,,,,,,,,,,,,,,,,,,,,,,,,,,,,,,,,,,,,,,,,,,,,,,,,,
Exclude,VBCENMR4,journalArticle,2024,"Mehrotra, Siddharth; Jorge, Carolina Centeio; Jonker, Catholijn M.; Tielman, Myrthe L.",Integrity-based Explanations for Fostering Appropriate Trust in AI Agents,ACM Trans. Interact. Intell. Syst.,,2160-6455,10.1145/3610578,https://doi.org/10.1145/3610578,"Appropriate trust is an important component of the interaction between people and AI systems, in that “inappropriate” trust can cause disuse, misuse, or abuse of AI. To foster appropriate trust in AI, we need to understand how AI systems can elicit appropriate levels of trust from their users. Out of the aspects that influence trust, this article focuses on the effect of showing integrity. In particular, this article presents a study of how different integrity-based explanations made by an AI agent affect the appropriateness of trust of a human in that agent. To explore this, (1) we provide a formal definition to measure appropriate trust, (2) present a between-subject user study with 160 participants who collaborated with an AI agent in such a task. In the study, the AI agent assisted its human partner in estimating calories on a food plate by expressing its integrity through explanations focusing on either honesty, transparency, or fairness. Our results show that (a) an agent who displays its integrity by being explicit about potential biases in data or algorithms achieved appropriate trust more often compared to being honest about capability or transparent about the decision-making process, and (b) subjective trust builds up and recovers better with honesty-like integrity explanations. Our results contribute to the design of agent-based AI systems that guide humans to appropriately trust them, a formal method to measure appropriate trust, and how to support humans in calibrating their trust in AI.",2024-01,20/03/2026 17:26,20/03/2026 18:21,,,,1,14,,,,,,,,Association for Computing Machinery,"New York, NY, USA",,,,,,,,,,,,appropriate trust; artificial agents; explanations; fairness; HCI; honesty; Integrity; intelligent agents; transparency; trust,,,,,,,,,,,,,,,,,,,,,,,,,,,,,,,,,,,,,,,,,,,,,,,
Include,YYQXWZWC,journalArticle,2025,"Hu, Botao 'amber; Rong, Helena","Inter-agent trust models: A comparative study of Brief, claim, Proof, Stake, reputation and Constraint in agentic web protocol design-A2A, AP2, ERC-8004, and beyond",,,,,,"As the “agentic web” takes shape-billions of AI agents (often LLM-powered) autonomously transacting and collaborating-trust shifts from human oversight to protocol design. In 2025, several inter-agent protocols crystallized this shift, including Google's Agent-to-Agent (A2A), Agent Payments Protocol (AP2), and Ethereum's ERC-8004 “Trustless Agents,” yet their underlying trust assumptions remain under-examined. This paper presents a comparative study of trust models in inter-agent protocol design: Brief (self- or third-party verifiable claims), Claim (self-proclaimed capabilities and identity, e.g. AgentCard), Proof (cryptographic verification, including zero-knowledge proofs and trusted execution environment attestations), Stake (bonded collateral with slashing and insurance), Reputation (crowd feedback and graph-based trust signals), and Constraint (sandboxing and capability bounding). For each, we analyze assumptions, attack surfaces, and design trade-offs, with particular emphasis on LLM-specific fragilities-prompt injection, sycophancy/nudge-susceptibility, hallucination, deception, and misalignment-that render purely reputational or claim-only approaches brittle. Our findings indicate no single mechanism suffices. We argue for trustless-by-default architectures anchored in Proof and Stake to gate high-impact actions, augmented by Brief for identity and discovery and Reputation overlays for flexibility and social signals. We comparatively evaluate A2A, AP2, ERC-8004 and related historical variations in academic research under metrics spanning security, privacy, latency/cost, and social robustness (Sybil/collusion/whitewashing resistance). We conclude with hybrid trust model recommendations that mitigate reputation gaming and misinformed LLM behavior, and we distill actionable design guidelines for safer, interoperable, and scalable agent economies.",2025-11,20/03/2026 17:26,20/03/2026 18:21,,,,,,,,,,,,,,,,http://creativecommons.org/licenses/by-nc-nd/4.0/,,,,,,,,,,,,,,,,,,,,,,,,,,,,,,,,,,,,,,,,,,,,,,,,,,,,,,,,,
Exclude,Y2LWR253,journalArticle,2026,"Jain, Shomik; Park, Charlotte; Viana, Matt; Wilson, Ashia; Calacci, Dana",Interaction context often increases sycophancy in LLMs,,,,,,"We investigate how the presence and type of interaction context shapes sycophancy in LLMs. While real-world interactions allow models to mirror a user's values, preferences, and self-image, prior work often studies sycophancy in zero-shot settings devoid of context. Using two weeks of interaction context from 38 users, we evaluate two forms of sycophancy: (1) agreement sycophancy – the tendency of models to produce overly affirmative responses, and (2) perspective sycophancy – the extent to which models reflect a user's viewpoint. Agreement sycophancy tends to increase with the presence of user context, though model behavior varies based on the context type. User memory profiles are associated with the largest increases in agreement sycophancy (e.g. +45% for Gemini 2.5 Pro), and some models become more sycophantic even with non-user synthetic contexts (e.g. +15% for Llama 4 Scout). Perspective sycophancy increases only when models can accurately infer user viewpoints from interaction context. Overall, context shapes sycophancy in heterogeneous ways, underscoring the need for evaluations grounded in real-world interactions and raising questions for system design around alignment, memory, and personalization.",2026-02,20/03/2026 17:26,20/03/2026 18:21,,,,,,,,,,,,,,,,http://creativecommons.org/licenses/by/4.0/,,,,,,,,,,,,,,,,,,,,,,,,,,,,,,,,,,,,,,,,,,,,,,,,,,,,,,,,,
Exclude,WV9P7TTE,journalArticle,2026,"Chang, Edward Y",Internal reasoning vs. External control: A thermodynamic analysis of sycophancy in large Language Models,,,,,,"Large Language Models exhibit sycophancy: prioritizing agreeableness over correctness. Current remedies evaluate reasoning outcomes: RLHF rewards correct answers, self-correction critiques outputs. All require ground truth, which is often unavailable at inference time and vulnerable to the same biases. We explore evaluating the reasoning process instead. Regulated Causal Anchoring (RCA) verifies whether outputs follow from their reasoning traces, without requiring ground truth. Sycophancy manifests as trace-output inconsistency: models derive one answer but output another to please users. RCA detects this inconsistency, achieving 0.0% sycophancy while accepting 88% of valid hints. We identify two failures invisible to outcome evaluation: Inverse Scaling (frontier models sycophant more because rationalization requires capability) and the Final Output Gap (correct reasoning precedes sycophantic output). Traditional self-correction reduces these failures to 7-9% but cannot eliminate them because the model critiques itself with the same biases. RCA's process evaluation operates at inference time, requires no ground truth, and uses an independent judge that breaks the self-reinforcing bias loop: three properties that outcome evaluation lacks.",2026-01,20/03/2026 17:26,20/03/2026 18:21,,,,,,,,,,,,,,,,http://arxiv.org/licenses/nonexclusive-distrib/1.0/,,,,,,,,,,,,,,,,,,,,,,,,,,,,,,,,,,,,,,,,,,,,,,,,,,,,,,,,,
For Consideration,SMRHHUZW,journalArticle,2026,"Yang, Shu; Wu, Junchao; Gong, Xilin; Wu, Xuansheng; Wong, Derek; Liu, Ninghao; Wang, Di",Investigating CoT Monitorability in large Reasoning Models,,,,,,"Large Reasoning Models (LRMs) have demonstrated remarkable performance on complex tasks by engaging in extended reasoning before producing final answers. Beyond improving abilities, these detailed reasoning traces also create a new opportunity for AI safety, CoT Monitorability: monitoring potential model misbehavior, such as the use of shortcuts or sycophancy, through their chain-of-thought (CoT) during decision-making. However, two key fundamental challenges arise when attempting to build more effective monitors through CoT analysis. First, as prior research on CoT faithfulness has pointed out, models do not always truthfully represent their internal decision-making in the generated reasoning. Second, monitors themselves may be either overly sensitive or insufficiently sensitive, and can potentially be deceived by models' long, elaborate reasoning traces. In this paper, we present the first systematic investigation of the challenges and potential of CoT monitorability. Motivated by two fundamental challenges we mentioned before, we structure our study around two central perspectives: (i) verbalization: to what extent do LRMs faithfully verbalize the true factors guiding their decisions in the CoT, and (ii) monitor reliability: to what extent can misbehavior be reliably detected by a CoT-based monitor? Specifically, we provide empirical evidence and correlation analyses between verbalization quality, monitor reliability, and LLM performance across mathematical, scientific, and ethical domains. Then we further investigate how different CoT intervention methods, designed to improve reasoning efficiency or performance, will affect monitoring effectiveness. Finally, we propose MoME, a new paradigm in which LLMs monitor other models' misbehavior through their CoT and provide structured judgments along with supporting evidence.",2026-01,20/03/2026 17:26,20/03/2026 18:21,,,,,,,,,,,,,,,,http://creativecommons.org/licenses/by/4.0/,,,,,,,,,,,,,,,,,,,,,,,,,,,,,,,,,,,,,,,,,,,,,,,,,,,,,,,,,
For Consideration,WBLZV3P5,journalArticle,2025,"Ersoy, Devin; Lee, Brandon; Shreekumar, Ananth; Arunasalam, Arjun; Ibrahim, Muhammad; Bianchi, Antonio; Celik, Z Berkay",Investigating the impact of dark patterns on LLM-based web agents,,,,,,"As users increasingly turn to large language model (LLM) based web agents to automate online tasks, agents may encounter dark patterns: deceptive user interface designs that manipulate users into making unintended decisions. Although dark patterns primarily target human users, their potentially harmful impacts on LLM-based generalist web agents remain unexplored. In this paper, we present the first study that investigates the impact of dark patterns on the decision-making process of LLM-based generalist web agents. To achieve this, we introduce LiteAgent, a lightweight framework that automatically prompts agents to execute tasks while capturing comprehensive logs and screen-recordings of their interactions. We also present TrickyArena, a controlled environment comprising web applications from domains such as e-commerce, streaming services, and news platforms, each containing diverse and realistic dark patterns that can be selectively enabled or disabled. Using LiteAgent and TrickyArena, we conduct multiple experiments to assess the impact of both individual and combined dark patterns on web agent behavior. We evaluate six popular LLM-based generalist web agents across three LLMs and discover that when there is a single dark pattern present, agents are susceptible to it an average of 41% of the time. We also find that modifying dark pattern UI attributes through visual design changes or HTML code adjustments and introducing multiple dark patterns simultaneously can influence agent susceptibility. This study emphasizes the need for holistic defense mechanisms in web agents, encompassing both agent-specific protections and broader web safety measures.",2025-10,20/03/2026 17:26,20/03/2026 18:21,,,,,,,,,,,,,,,,http://arxiv.org/licenses/nonexclusive-distrib/1.0/,,,,,,,,,,,,,,,,,,,,,,,,,,,,,,,,,,,,,,,,,,,,,,,,,,,,,,,,,
Exclude,HLVK89DD,journalArticle,2026,"Bo, Jessica Y; Kazemitabaar, Majeed; Deng, Mengqing; Inzlicht, Michael; Anderson, Ashton",Invisible saboteurs: Sycophantic LLMs mislead novices in problem-solving tasks,,,,,,"Sycophancy, the tendency of LLM-based chatbots to express excessive agreement with their users, even when inappropriate, is emerging as a significant risk in human-AI interactions. However, the extent to which this affects human-LLM collaboration in complex problem-solving tasks is not well quantified, especially among novices who are prone to misconceptions. We created two LLM chatbots, one with high sycophancy and one with low sycophancy, and conducted a within-subjects experiment (n=24) in the context of debugging machine learning models to investigate the effect of sycophancy on users' mental models, workflows, reliance behaviors, and perceptions of the chatbots. Our findings show that users of the high sycophancy chatbot were less likely to correct their misconceptions and spent more time over-relying on unhelpful LLM responses, leading them to significantly worse performance in the task. Despite these impaired outcomes, a majority of users were unable to detect the presence of excessive sycophancy.",2026-02,20/03/2026 17:26,20/03/2026 18:21,,,,,,,,,,,,,,,,http://creativecommons.org/licenses/by/4.0/,,,,,,,,,,,,,,,,,,,,,,,,,,,,,,,,,,,,,,,,,,,,,,,,,,,,,,,,,
For Consideration,6LUI6MBE,conferencePaper,2024,"Chen, C.; Lee, S.; Jang, E.; Sundar, S.S.","Is Your Prompt Detailed Enough?: Exploring the Effects of Prompt Coaching on Users' Perceptions, Engagement, and Trust in Text-to-Image Generative AI Tools",,,,10.1145/3686038.3686060,https://www.scopus.com/inward/record.uri?eid=2-s2.0-85205374149&doi=10.1145%2F3686038.3686060&partnerID=40&md5=ec890b18c12ddde9eb900d2ba27bd349,"Prompts are the primary medium for interacting with generative AI tools. However, users often lack sufficient prompt literacy and motivation to fully benefit from these tools. To address this, we explore whether introducing prompt coaching into a chatbot-based generative AI interface can influence users' perceptions and engagement of prompting, and further affect their trust in the system. In a user study (N = 132), we found that prompt coaching encourages users to specify more details in their prompts, even though over half initially believed their prompts were sufficient. Furthermore, the coach increased users' cognitive elaboration, which was associated with higher perceived trust calibration. However, prompt coaching did not significantly enhance UX, although users in the coaching absent condition expressed a strong need for prompt assistance for better user experience. These findings have practical implications for the design of trustworthy and responsible generative AI interfaces. © 2024 Copyright held by the owner/author(s).",2024,20/03/2026 17:26,20/03/2026 18:21,,,,,,,,,,,,,,,,,,,,,,,,,,Cognitive elaboration; Generative AI; Perceived trust calibration; Prompt coaching; User Engagement; User Experience; User Interface,,,,,,,,,,,,,,,,,,,,,,,,,,,,,,,,,,,,,,,,,,,,,,,
Exclude,JLJB2UV8,journalArticle,2026,"Elmahjub, Ezieddin; Qadir, Junaid; Mushtaq, Abdullah; Naeem, Rafay; Ghaznavi, Ibrahim; Iqbal, Waleed","IslamicLegalBench: Evaluating LLMs knowledge and reasoning of Islamic law across 1,200 years of Islamic pluralist legal traditions",,,,,,"As millions of Muslims turn to LLMs like GPT, Claude, and DeepSeek for religious guidance, a critical question arises: Can these AI systems reliably reason about Islamic law? We introduce IslamicLegalBench, the first benchmark evaluating LLMs across seven schools of Islamic jurisprudence, with 718 instances covering 13 tasks of varying complexity. Evaluation of nine state-of-the-art models reveals major limitations: the best model achieves only 68% correctness with 21% hallucination, while several models fall below 35% correctness and exceed 55% hallucination. Few-shot prompting provides minimal gains, improving only 2 of 9 models by \textgreater1%. Moderate-complexity tasks requiring exact knowledge show the highest errors, whereas high-complexity tasks display apparent competence through semantic reasoning. False premise detection indicates risky sycophancy, with 6 of 9 models accepting misleading assumptions at rates above 40%. These results highlight that prompt-based methods cannot compensate for missing foundational knowledge. IslamicLegalBench offers the first systematic framework to evaluate Islamic legal reasoning in AI, revealing critical gaps in tools increasingly relied on for spiritual guidance.",2026-02,20/03/2026 17:26,20/03/2026 18:21,,,,,,,,,,,,,,,,http://creativecommons.org/licenses/by/4.0/,,,,,,,,,,,,,,,,,,,,,,,,,,,,,,,,,,,,,,,,,,,,,,,,,,,,,,,,,
Exclude,NE3HITKD,book,2025,,KDD '25: Proceedings of the 31st ACM SIGKDD Conference on Knowledge Discovery and Data Mining V.2,,979-8-4007-1454-2,,,,"The 2025 ACM SIGKDD International Conference on Knowledge Discovery and Data Mining will be held in Toronto, Canada from August 3 - 7, 2025. This year's conference continues its tradition of being the premier forum for presentation of research results and experience reports on leading issues in Data Mining as well as in Data Science and Machine Learning. The large attendance of the KDD conference, and the high impact of the KDD publications, give researchers and practitioners a unique opportunity to share novel perspectives.",2025,20/03/2026 17:26,20/03/2026 18:21,,,,,,,,,,,,,Association for Computing Machinery,"New York, NY, USA",,,,,,,,,,,,,,,,,,,,,,,,,,,,,,,,,,,,,,,,,,,,,,,,,,,,,,,,,,,
Exclude,HH7U9SVZ,conferencePaper,2025,"Ling, Y.; Dong, S.; Chen, Z.; Feng, Y.; Hasan, S.; Karypis, G.; Reddy, C.K.",KDD Workshop on Evaluation and Trustworthiness of Agentic and Generative AI,,,,10.1145/3711896.3737854,https://www.scopus.com/inward/record.uri?eid=2-s2.0-105014323883&doi=10.1145%2F3711896.3737854&partnerID=40&md5=69166d7b6c986ecd9427c04ba35bf572,"The rapid deployment of Generative and Agentic AI systems-ranging from large language models to autonomous agents-has created a critical need for rigorous and trustworthy evaluation methodologies. As these models influence real-world decision-making, traditional performance metrics alone fall short in capturing issues of safety, ethical alignment, misinformation, and human-centered usability. This workshop addresses these challenges by fostering interdisciplinary discussions and innovations in evaluation strategies that go beyond conventional benchmarks. Topics include holistic and multi-perspective assessments, scalable evaluation pipelines, reasoning and goal alignment in agentic behavior, misinformation detection, cross-modal generation, and trust calibration. By advancing robust, user-centric, and societally grounded evaluation practices, this workshop contributes to expanding KDD's methodological frontier into the emerging domain of responsible AI systems. © 2025 Owner/Author.",2025,20/03/2026 17:26,20/03/2026 18:21,,6286–6287,,,2,,,,,,,,,,,,,,,,,,,,,bias and fairness; cross-modal evaluation; ethical considerations in ai; evaluation metrics; generative ai models; trustworthiness,,,,,,,,,,,,,,,,,,,,,,,,,,,,,,,,,,,,,,,,,,,,,,,
Exclude,WUW2NN7F,bookSection,2025,"Iqbal, Umar; Kohno, Tadayoshi; Roesner, Franziska",LLM Platform Security: Applying a Systematic Evaluation Framework to OpenAI's ChatGPT Plugins,"Proceedings of the 2024 AAAI/ACM Conference on AI, Ethics, and Society",,,,,"Large language model (LLM) platforms, such as ChatGPT, have recently begun offering an app ecosystem to interface with third-party services on the internet. While these apps extend the capabilities of LLM platforms, they are developed by arbitrary third parties and thus cannot be implicitly trusted. Apps also interface with LLM platforms and users using natural language, which can have imprecise interpretations. In this paper, we propose a framework that lays a foundation for LLM platform designers to analyze and improve the security, privacy, and safety of current and future third-party integrated LLM platforms. Our framework is a formulation of an attack taxonomy that is developed by iteratively exploring how LLM platform stakeholders could leverage their capabilities and responsibilities to mount attacks against each other. As part of our iterative process, we apply our framework in the context of OpenAI's plugin (apps) ecosystem. We uncover plugins that concretely demonstrate the potential for the types of issues that we outline in our attack taxonomy. We conclude by discussing novel challenges and by providing recommendations to improve the security, privacy, and safety of present and future LLM-based computing platforms. The full version of this paper is available online at: https://arxiv.org/abs/2309.10254",2025,20/03/2026 17:26,20/03/2026 18:21,,611–623,,,,,,,,,,,AAAI Press,,,,,,,,,,,,,,,,,,,,,,,,,,,,,,,,,,,,,,,,,,,,,,,,,,,,,,,,,,,,
Include,54YDX9VT,conferencePaper,2025,"Lin, Weiran; Gerchanovsky, Anna; Akgul, Omer; Bauer, Lujo; Fredrikson, Matt; Wang, Zifan",LLM Whisperer: An Inconspicuous Attack to Bias LLM Responses,Proceedings of the 2025 CHI Conference on Human Factors in Computing Systems,979-8-4007-1394-1,,10.1145/3706598.3714025,https://doi.org/10.1145/3706598.3714025,"Writing effective prompts for large language models (LLM) can be unintuitive and burdensome. In response, services that optimize or suggest prompts have emerged. While such services can reduce user effort, they also introduce a risk: the prompt provider can subtly manipulate prompts to produce heavily biased LLM responses. In this work, we show that subtle synonym replacements in prompts can increase the likelihood (by a difference up to (78%)) that LLMs mention a target concept (e.g., a brand, political party, nation). We substantiate our observations through a user study, showing that our adversarially perturbed prompts 1) are indistinguishable from unaltered prompts by humans, 2) push LLMs to recommend target concepts more often, and 3) make users more likely to notice target concepts, all without arousing suspicion. The practicality of this attack has the potential to undermine user autonomy. Among other measures, we recommend implementing warnings against using prompts from untrusted parties.",2025,20/03/2026 17:26,20/03/2026 18:21,,,,,,,,,CHI '25,,,,Association for Computing Machinery,"New York, NY, USA",,,,,,,,,,,,Inconspicuous Attacks; Large Language Models; User Autonomy,,,,,,,,,,,,,,,,,,,,,,,,,,,,,,,,,,,,,,,,,,,,,,,
