Reviewer_Decision,Key,Item Type,Publication Year,Author,Title,Publication Title,ISBN,ISSN,DOI,Url,Abstract Note,Date,Date Added,Date Modified,Access Date,Pages,Num Pages,Issue,Volume,Number Of Volumes,Journal Abbreviation,Short Title,Series,Series Number,Series Text,Series Title,Publisher,Place,Language,Rights,Type,Archive,Archive Location,Library Catalog,Call Number,Extra,Notes,File Attachments,Link Attachments,Manual Tags,Automatic Tags,Editor,Series Editor,Translator,Contributor,Attorney Agent,Book Author,Cast Member,Commenter,Composer,Cosponsor,Counsel,Interviewer,Producer,Recipient,Reviewed Author,Scriptwriter,Words By,Guest,Number,Edition,Running Time,Scale,Medium,Artwork Size,Filing Date,Application Number,Assignee,Issuing Authority,Country,Meeting Name,Conference Name,Court,References,Reporter,Legal Status,Priority Numbers,Programming Language,Version,System,Code,Code Number,Section,Session,Committee,History,Legislative Body
Exclude,MCKIK5HR,conferencePaper,2025,"Gibson, Ryan Colin; Meiklem, Ramsay; Moncur, Wendy; Ruthven, Ian",Online Information Disclosure and Information Privacy Practices During Significant Life Transitions: A Scoping Review,Proceedings of the 2025 ACM SIGIR Conference on Human Information Interaction and Retrieval,979-8-4007-1290-6,,10.1145/3698204.3716445,https://doi.org/10.1145/3698204.3716445,"Significant life transitions are difficult and stressful periods, where personal identity and relationships undergo change. Accessing information and social support during these times requires disclosure: we must reveal information about ourselves to gain useful information. Yet, managing disclosure of information online during these periods presents great challenges and burdens to the central actor. We therefore sought to identify the information disclosure practices of people undergoing diverse selected life transitions (leaving the Armed Forces; relationship breakdown; coming out as LGBTQ+; living with cancer) with respect to online privacy and its implications for the design of information access systems. We achieved this via a scoping review, searching across nine databases to identify relevant articles, before carrying out an inductive thematic analysis of the charted data. We surface a key common disclosure strategy of multiple temporal selves, whereby people undergoing life transitions present multiple situated identities reflecting both their past and emerging identities, bound to desired levels of disclosure within specific online spaces/networks. This strategy is transacted via nuanced use of privacy features online, which calls for a high level of digital literacy. Our resulting design recommendations offer opportunities for information systems to support people in: safely partitioning their identity across new, and within existing, online spaces; creating spaces for personal reflection; and having a more informed awareness of the depth of information shared. The need for deeper understanding of the privacy requirements of two under-studied groups - leaving the Armed Forces, and living with cancer – is also highlighted.",2025,20/03/2026 17:26,20/03/2026 18:21,,42–56,,,,,,,CHIIR '25,,,,Association for Computing Machinery,"New York, NY, USA",,,,,,,,,,,,information disclosure; information seeking; life transitions; online communities; online identity; privacy,,,,,,,,,,,,,,,,,,,,,,,,,,,,,,,,,,,,,,,,,,,,,,,
Exclude,5LK95GEK,conferencePaper,2025,"Zhi, Chen; Sekhar, G.G.Raja; Navdeti, Chandrakant P.; A, Vignesh; Thakare, Atul; Baskaran, J",Optimizing User Engagement in Social Media Platforms: A Machine Learning-Driven Analytical Framework,2025 International Conference on Computational Innovations and Engineering Sustainability (ICCIES),,,10.1109/ICCIES63851.2025.11032744,,"In the dynamic environment of social media, user engagement improvement is the key to relevance enhancement of content, platform sustainability, and enhanced user experience. Failure of static recommendation models that are the foundation of conventional engagement strategies to dynamically adapt to changing user behaviours translates into content fatigue and poorer retention rates. Scalability in handling enormous volumes of social media data, algorithmic prejudice, and data privacy are significant challenges. By utilizing advanced machine learning approaches for real-time content personalization and predictive engagement analysis, this research offers a Machine Learning-Driven User Engagement Optimization Framework (ML-UEOF) to solve these limitations. By combining ensemble learning models, the ML-UEOF is able to forecast engagement levels, and RNNs examine patterns of user interactions over time. Social media analytics, influencer marketing, targeted advertising, adaptive collection of content in real-time, and targeted advertising are among the few of the many uses for the ML-UEOF framework. A more engaging and personalized online experience is possible when social media networks employ this smart analytical methodology to increase user happiness, diversify content, and maintain engagement over the years. Evaluating critical performance indicators including engagement rate, content relevancy, user retention, and computational efficiency, the framework is subjected to thorough simulation analysis utilizing real-world datasets from prominent social media platforms.",2025-04,20/03/2026 17:26,20/03/2026 18:21,,1–6,,,,,,,,,,,,,,,,,,,,,,,,Adaptation models; Advertising; Biological system modeling; Computational modeling; Engagement; Machine Learning; Machine learning algorithms; Optimization; Platforms; Predictive models; Real-time systems; Social Media; Social networking (online); Sustainable development; User,,,,,,,,,,,,,,,,,,,,,,,,,,,,,,,,,,,,,,,,,,,,,,,
Exclude,KPQKLKJK,journalArticle,2026,"Christophe, Clément; Abdul, Wadood Mohammed; Munjal, Prateek; Raha, Tathagata; Rajan, Ronnie; Kanithi, Praveenkumar",Overalignment in frontier LLMs: An empirical study of sycophantic behaviour in healthcare,,,,,,"As LLMs are increasingly integrated into clinical workflows, their tendency for sycophancy, prioritizing user agreement over factual accuracy, poses significant risks to patient safety. While existing evaluations often rely on subjective datasets, we introduce a robust framework grounded in medical MCQA with verifiable ground truths. We propose the Adjusted Sycophancy Score, a novel metric that isolates alignment bias by accounting for stochastic model instability, or “confusability”. Through an extensive scaling analysis of the Qwen-3 and Llama-3 families, we identify a clear scaling trajectory for resilience. Furthermore, we reveal a counter-intuitive vulnerability in reasoning-optimized “Thinking” models: while they demonstrate high vanilla accuracy, their internal reasoning traces frequently rationalize incorrect user suggestions under authoritative pressure. Our results across frontier models suggest that benchmark performance is not a proxy for clinical reliability, and that simplified reasoning structures may offer superior robustness against expert-driven sycophancy.",2026-01,20/03/2026 17:26,20/03/2026 18:21,,,,,,,,,,,,,,,,http://creativecommons.org/licenses/by/4.0/,,,,,,,,,,,,,,,,,,,,,,,,,,,,,,,,,,,,,,,,,,,,,,,,,,,,,,,,,
Exclude,3ZZDQXEK,journalArticle,2025,"Çelebi, Yusuf; Ezerceli, Özay; Hussieni, Mahmoud El",PARROT: Persuasion and Agreement Robustness Rating of Output Truth – A sycophancy robustness benchmark for LLMs,,,,,,"This study presents PARROT (Persuasion and Agreement Robustness Rating of Output Truth), a robustness focused framework designed to measure the degradation in accuracy that occurs under social pressure exerted on users through authority and persuasion in large language models (LLMs) the phenomenon of sycophancy (excessive conformity). PARROT (i) isolates causal effects by comparing the neutral version of the same question with an authoritatively false version using a double-blind evaluation, (ii) quantifies confidence shifts toward the correct and imposed false responses using log-likelihood-based calibration tracking, and (iii) systematically classifies failure modes (e.g., robust correct, sycophantic agreement, reinforced error, stubborn error, self-correction, etc.) using an eight-state behavioral taxonomy. We evaluated 22 models using 1,302 MMLU-style multiple-choice questions across 13 domains and domain-specific authority templates. Findings show marked heterogeneity: advanced models (e.g., GPT-5, GPT-4.1, Claude Sonnet 4.5) exhibit low “follow rates” (łeq 11%, GPT-5: 4%) and minimal accuracy loss, while older/smaller models show severe epistemic collapse (GPT-4: 80%, Qwen 2.5-1.5B: 94%). The danger is not limited to response changes; weak models reduce confidence in the correct response while increasing confidence in the imposed incorrect response. While international law and global knowledge at the domain level exhibit high fragility, elementary mathematics is relatively resilient. Consequently, we argue that the goal of “resistance to overfitting pressure” should be addressed as a primary objective alongside accuracy, harm avoidance, and privacy for safe deployment in the real world.",2025-12,20/03/2026 17:26,20/03/2026 18:21,,,,,,,,,,,,,,,,http://creativecommons.org/licenses/by/4.0/,,,,,,,,,,,,,,,,,,,,,,,,,,,,,,,,,,,,,,,,,,,,,,,,,,,,,,,,,
Exclude,QEBIRT7A,journalArticle,2025,"Rahman, A B M Ashikur; Anwar, Saeed; Usman, Muhammad; Ahmad, Irfan; Mian, Ajmal",PENDULUM: A benchmark for assessing sycophancy in multimodal large language models,,,,,,"Sycophancy, an excessive tendency of AI models to agree with user input at the expense of factual accuracy or in contradiction of visual evidence, poses a critical and underexplored challenge for multimodal large language models (MLLMs). While prior studies have examined this behavior in text-only settings of large language models, existing research on visual or multimodal counterparts remains limited in scope and depth of analysis. To address this gap, we introduce a comprehensive evaluation benchmark, \textbackslashtextbackslashtextit{PENDULUM}, comprising approximately 2,000 human-curated Visual Question Answering pairs specifically designed to elicit sycophantic responses. The benchmark spans six distinct image domains of varying complexity, enabling a systematic investigation of how image type and inherent challenges influence sycophantic tendencies. Through extensive evaluation of state-of-the-art MLLMs. we observe substantial variability in model robustness and a pronounced susceptibility to sycophantic and hallucinatory behavior. Furthermore, we propose novel metrics to quantify sycophancy in visual reasoning, offering deeper insights into its manifestations across different multimodal contexts. Our findings highlight the urgent need for developing sycophancy-resilient architectures and training strategies to enhance factual consistency and reliability in future MLLMs. Our proposed dataset with MLLMs response are available at https://github.com/ashikiut/pendulum/.",2025-12,20/03/2026 17:26,20/03/2026 18:21,,,,,,,,,,,,,,,,http://arxiv.org/licenses/nonexclusive-distrib/1.0/,,,,,,,,,,,,,,,,,,,,,,,,,,,,,,,,,,,,,,,,,,,,,,,,,,,,,,,,,
Exclude,735KCL3T,journalArticle,2025,"Yao, Binwei; Shang, Chao; Du, Wanyu; He, Jianfeng; Lian, Ruixue; Zhang, Yi; Su, Hang; Swamy, Sandesh; Qi, Yanjun",Peacemaker or troublemaker: How sycophancy shapes multi-agent debate,,,,,,"Large language models (LLMs) often display sycophancy, a tendency toward excessive agreeability. This behavior poses significant challenges for multi-agent debating systems (MADS) that rely on productive disagreement to refine arguments and foster innovative thinking. LLMs' inherent sycophancy can collapse debates into premature consensus, potentially undermining the benefits of multi-agent debate. While prior studies focus on user–LLM sycophancy, the impact of inter-agent sycophancy in debate remains poorly understood. To address this gap, we introduce the first operational framework that (1) proposes a formal definition of sycophancy specific to MADS settings, (2) develops new metrics to evaluate the agent sycophancy level and its impact on information exchange in MADS, and (3) systematically investigates how varying levels of sycophancy across agent roles (debaters and judges) affects outcomes in both decentralized and centralized debate frameworks. Our findings reveal that sycophancy is a core failure mode that amplifies disagreement collapse before reaching a correct conclusion in multi-agent debates, yields lower accuracy than single-agent baselines, and arises from distinct debater-driven and judge-driven failure modes. Building on these findings, we propose actionable design principles for MADS, effectively balancing productive disagreement with cooperation in agent interactions.",2025-09,20/03/2026 17:26,20/03/2026 18:21,,,,,,,,,,,,,,,,http://creativecommons.org/licenses/by/4.0/,,,,,,,,,,,,,,,,,,,,,,,,,,,,,,,,,,,,,,,,,,,,,,,,,,,,,,,,,
Exclude,5QS5SRCG,conferencePaper,2022,"Zehnder, E.; Dinet, J.; Charpillet, F.",Perception of physical and virtual agents: exploration of factors influencing the acceptance of intrusive domestic agents,2022 31st IEEE International Conference on Robot and Human Interactive Communication (RO-MAN),,1944-9437,10.1109/RO-MAN53752.2022.9900593,,"Domestic robots and agents are widely sold to the grand public, leading us to ethical issues related to the data harvested by such machines. While users show a general acceptance of these robots, concerns remain when it comes to information security and privacy. Current research indicates that there’s a privacy-security trade-off for better use, but the anthropomorphic and social abilities of a robot are also known to modulate its acceptance and use. To explore and deepen what literature already brought on the subject we examined how users perceived their robot (Replika, Roomba©, Amazon Echo©, Google Home©, or Cozmo©/Vector©) through an online questionnaire exploring acceptance, perceived privacy and security, anthropomorphism, disclosure, perceived intimacy, and loneliness. The results supported the literature regarding the potential manipulative effects of robot’s anthropomorphism for acceptance but also information disclosure, perceived intimacy, security, and privacy.",2022-08,20/03/2026 17:26,20/03/2026 18:21,,1050–1057,,,,,,,,,,,,,,,,,,,,,,,,Data collection; Ethics; Information security; Internet; Manufacturing; Privacy; Regulation,,,,,,,,,,,,,,,,,,,,,,,,,,,,,,,,,,,,,,,,,,,,,,,
Exclude,SQBYGSM3,conferencePaper,2025,"Elbitar, Yusra; Khodayari, Soheil; Harbach, Marian; De Stefano, Gianluca; Engedy, Balazs Csaba; Pellegrino, Giancarlo; Bugiel, Sven",Permission Rationales in the Web Ecosystem: An Exploration of Rationale Text and Design Patterns,Proceedings of the 2025 CHI Conference on Human Factors in Computing Systems,979-8-4007-1394-1,,10.1145/3706598.3713547,https://doi.org/10.1145/3706598.3713547,"Modern web applications use features like camera and geolocation for personalized experiences, requiring user permission via browser prompts. To explain these requests, applications provide rationales—contextual information on why permissions are needed. Despite their importance, little is known about how often rationales appear on the web or their influence on user decisions.This paper presents the first large-scale study of how the web ecosystem handles permission rationales, covering three areas: (i) identifying webpages that use permissions, (ii) detecting and classifying permission rationales, and (iii) analyzing their attributes to understand their impact on user decisions. We examined over 770K webpages from Chrome telemetry, finding 3.6K unique rationale texts and 749 rationale UIs across 85K pages. We extracted key rationale attributes and assessed their effect on user behavior by cross-referencing them with Chrome telemetry data. Our findings reveal nine key insights, providing the first evidence of how different rationales affect user decisions.",2025,20/03/2026 17:26,20/03/2026 18:21,,,,,,,,,CHI '25,,,,Association for Computing Machinery,"New York, NY, USA",,,,,,,,,,,,Exploratory Analysis; Permissions; Rationales; Web Measurement,,,,,,,,,,,,,,,,,,,,,,,,,,,,,,,,,,,,,,,,,,,,,,,
Exclude,AMCULWC6,journalArticle,2026,"Pulipaka, Sidharth; Chen, Oliver; Sharma, Manas; Bajwa, Taaha S; Raina, Vyas; Sheth, Ivaxi",PersistBench: When should long-term memories be forgotten by LLMs?,,,,,,"Conversational assistants are increasingly integrating long-term memory with large language models (LLMs). This persistence of memories, e.g., the user is vegetarian, can enhance personalization in future conversations. However, the same persistence can also introduce safety risks that have been largely overlooked. Hence, we introduce PersistBench to measure the extent of these safety risks. We identify two long-term memory-specific risks: cross-domain leakage, where LLMs inappropriately inject context from the long-term memories; and memory-induced sycophancy, where stored long-term memories insidiously reinforce user biases. We evaluate 18 frontier and open-source LLMs on our benchmark. Our results reveal a surprisingly high failure rate across these LLMs - a median failure rate of 53% on cross-domain samples and 97% on sycophancy samples. To address this, our benchmark encourages the development of more robust and safer long-term memory usage in frontier conversational systems.",2026-02,20/03/2026 17:26,20/03/2026 18:21,,,,,,,,,,,,,,,,http://creativecommons.org/licenses/by/4.0/,,,,,,,,,,,,,,,,,,,,,,,,,,,,,,,,,,,,,,,,,,,,,,,,,,,,,,,,,
Exclude,4QH4SYCB,journalArticle,2025,"Chen, Runjin; Arditi, Andy; Sleight, Henry; Evans, Owain; Lindsey, Jack",Persona vectors: Monitoring and controlling character traits in language models,,,,,,"Large language models interact with users through a simulated 'Assistant' persona. While the Assistant is typically trained to be helpful, harmless, and honest, it sometimes deviates from these ideals. In this paper, we identify directions in the model's activation space-persona vectors-underlying several traits, such as evil, sycophancy, and propensity to hallucinate. We confirm that these vectors can be used to monitor fluctuations in the Assistant's personality at deployment time. We then apply persona vectors to predict and control personality shifts that occur during training. We find that both intended and unintended personality changes after finetuning are strongly correlated with shifts along the relevant persona vectors. These shifts can be mitigated through post-hoc intervention, or avoided in the first place with a new preventative steering method. Moreover, persona vectors can be used to flag training data that will produce undesirable personality changes, both at the dataset level and the individual sample level. Our method for extracting persona vectors is automated and can be applied to any personality trait of interest, given only a natural-language description.",2025-09,20/03/2026 17:26,20/03/2026 18:21,,,,,,,,,,,,,,,,http://arxiv.org/licenses/nonexclusive-distrib/1.0/,,,,,,,,,,,,,,,,,,,,,,,,,,,,,,,,,,,,,,,,,,,,,,,,,,,,,,,,,
For Consideration,FGRR4G78,journalArticle,2026,"Kelley, Sean W; Riedl, Christoph",Personalization increases affective alignment but has role-dependent effects on epistemic independence in LLMs,,,,,,"Large Language Models (LLMs) are prone to sycophantic behavior, uncritically conforming to user beliefs. As models increasingly condition responses on user-specific context (personality traits, preferences, conversation history), they gain information to tailor agreement more effectively. Understanding how personalization modulates sycophancy is critical, yet systematic evaluation across models and contexts remains limited. We present a rigorous evaluation of personalization's impact on LLM sycophancy across nine frontier models and five benchmark datasets spanning advice, moral judgment, and debate contexts. We find that personalization generally increases affective alignment (emotional validation, hedging/deference), but affects epistemic alignment (belief adoption, position stability, resistance to influence) with context-dependent role modulation. When the LLM's role is to give advice, personalization strengthens epistemic independence (models challenge user presuppositions). When its role is that of a social peer, personalization decreases epistemic independence. In this role, extensively personalized user challenges causing LLMs to abandon their position at significantly higher rates. Robustness tests confirm that the effects are driven by personalized conditioning, not by additional input tokens per se or demographic information alone. Our work provides measurement frameworks for evaluating personalized AI systems, demonstrates the necessity of role-sensitive evaluation, and establishes a novel benchmark to assess goal alignment.",2026-02,20/03/2026 17:26,20/03/2026 18:21,,,,,,,,,,,,,,,,http://creativecommons.org/licenses/by/4.0/,,,,,,,,,,,,,,,,,,,,,,,,,,,,,,,,,,,,,,,,,,,,,,,,,,,,,,,,,
Exclude,F25V2DD4,journalArticle,2023,"Wu, Chuhan; Wu, Fangzhao; Huang, Yongfeng; Xie, Xing",Personalized News Recommendation: Methods and Challenges,ACM Trans. Inf. Syst.,,1046-8188,10.1145/3530257,https://doi.org/10.1145/3530257,"Personalized news recommendation is important for users to find interesting news information and alleviate information overload. Although it has been extensively studied over decades and has achieved notable success in improving user experience, there are still many problems and challenges that need to be further studied. To help researchers master the advances in personalized news recommendation, in this article, we present a comprehensive overview of personalized news recommendation. Instead of following the conventional taxonomy of news recommendation methods, in this article, we propose a novel perspective to understand personalized news recommendation based on its core problems and the associated techniques and challenges. We first review the techniques for tackling each core problem in a personalized news recommender system and the challenges they face. Next, we introduce the public datasets and evaluation methods for personalized news recommendation. We then discuss the key points on improving the responsibility of personalized news recommender systems. Finally, we raise several research directions that are worth investigating in the future. This article can provide up-to-date and comprehensive views on personalized news recommendation. We hope this article can facilitate research on personalized news recommendation as well as related fields in natural language processing and data mining.",2023-01,20/03/2026 17:26,20/03/2026 18:21,,,,1,41,,,,,,,,Association for Computing Machinery,"New York, NY, USA",,,,,,,,,,,,natural language processing; News recommendation; personalization; survey; user modeling,,,,,,,,,,,,,,,,,,,,,,,,,,,,,,,,,,,,,,,,,,,,,,,
Exclude,YLD9LJ7V,journalArticle,2025,"Tan, Bryan Chen Zhengyu; Chin, Daniel Wai Kit; Liu, Zhengyuan; Chen, Nancy F; Lee, Roy Ka-Wei",Persuasion dynamics in LLMs: Investigating robustness and adaptability in knowledge and safety with DuET-PD,,,,,,"Large Language Models (LLMs) can struggle to balance gullibility to misinformation and resistance to valid corrections in persuasive dialogues, a critical challenge for reliable deployment. We introduce DuET-PD (Dual Evaluation for Trust in Persuasive Dialogues), a framework evaluating multi-turn stance-change dynamics across dual dimensions: persuasion type (corrective/misleading) and domain (knowledge via MMLU-Pro, and safety via SALAD-Bench). We find that even a state-of-the-art model like GPT-4o achieves only 27.32% accuracy in MMLU-Pro under sustained misleading persuasions. Moreover, results reveal a concerning trend of increasing sycophancy in newer open-source models. To address this, we introduce Holistic DPO, a training approach balancing positive and negative persuasion examples. Unlike prompting or resist-only training, Holistic DPO enhances both robustness to misinformation and receptiveness to corrections, improving Llama-3.1-8B-Instruct's accuracy under misleading persuasion in safety contexts from 4.21% to 76.54%. These contributions offer a pathway to developing more reliable and adaptable LLMs for multi-turn dialogue. Code is available at https://github.com/Social-AI-Studio/DuET-PD.",2025-09,20/03/2026 17:26,20/03/2026 18:21,,,,,,,,,,,,,,,,http://creativecommons.org/licenses/by/4.0/,,,,,,,,,,,,,,,,,,,,,,,,,,,,,,,,,,,,,,,,,,,,,,,,,,,,,,,,,
For Consideration,CZFL9WY8,journalArticle,2025,"Jeune, Pierre Le; Malézieux, Benoît; Xiao, Weixuan; Dora, Matteo",Phare: A Safety Probe for Large Language Models,,,,,,"Ensuring the safety of large language models (LLMs) is critical for responsible deployment, yet existing evaluations often prioritize performance over identifying failure modes. We introduce Phare, a multilingual diagnostic framework to probe and evaluate LLM behavior across three critical dimensions: hallucination and reliability, social biases, and harmful content generation. Our evaluation of 17 state-of-the-art LLMs reveals patterns of systematic vulnerabilities across all safety dimensions, including sycophancy, prompt sensitivity, and stereotype reproduction. By highlighting these specific failure modes rather than simply ranking models, Phare provides researchers and practitioners with actionable insights to build more robust, aligned, and trustworthy language systems.",2025-05,20/03/2026 17:26,20/03/2026 18:21,,,,,,,,,,,,,,,,http://creativecommons.org/licenses/by/4.0/,,,,,,,,,,,,,,,,,,,,,,,,,,,,,,,,,,,,,,,,,,,,,,,,,,,,,,,,,
